{
  "proofmeta": "1.0",
  "payload": {
    "type": "manifest",
    "provider": {
      "id": "did:key:z6MkqT3JBV3VoSp2Wn2hsh1YVvtDjxmS3j5Qk6hewXjcBY3a",
      "name": "ProofMeta — Pandr UG (haftungsbeschränkt)",
      "description": "The ProofMeta protocol project itself: specification, JSON schemas, reference SDK and browser tools."
    },
    "request_endpoint": "https://proofmeta.com/requests",
    "resolvers": [
      {
        "role": "delivery",
        "id": "https"
      }
    ],
    "license_types": [
      {
        "id": "apache-2.0",
        "name": "Apache License 2.0",
        "terms_url": "https://proofmeta.com/license.txt",
        "terms_hash": "sha256:97b06d58c91b3c78c83fce8492647ae42cb74d6247dd4c00da940a8bae4a2630",
        "scope": [
          "commercial",
          "derivative-allowed",
          "attribution-required",
          "sublicense-allowed",
          "ai-training-allowed"
        ]
      }
    ],
    "items": [
      {
        "item_id": "protocol-specification",
        "name": "ProofMeta Protocol Specification",
        "description": "SPEC.md — the master specification of the ProofMeta protocol.",
        "available_licenses": [
          "apache-2.0"
        ],
        "content_hash": "sha256:37816325cfc32943159b1bf783c7c0d4afe6fe49870c21e01b34b9633a83ee78",
        "metadata": {
          "url": "https://raw.githubusercontent.com/bettabeta/proofmeta/6b3bca545d49bea36124fc9d7b3078a052c70f3f/SPEC.md"
        }
      },
      {
        "item_id": "browser-tools-bundle",
        "name": "ProofMeta browser tools bundle",
        "description": "proofmeta-tools.min.js — the client-side SDK bundle powering the manifest generator and verifier.",
        "available_licenses": [
          "apache-2.0"
        ],
        "content_hash": "sha256:82e21a68598d13c6d789e4e7b4c081b4044537ab0362147f8db0da1590c4d0d0",
        "metadata": {
          "url": "https://proofmeta.com/tools/proofmeta-tools.min.js"
        }
      }
    ]
  },
  "payload_hash": "sha256:459e9b8332fcc50e6c8594545c57533aba6d139d83a32234d5e7828a4c9d9a40",
  "author": "did:key:z6MkqT3JBV3VoSp2Wn2hsh1YVvtDjxmS3j5Qk6hewXjcBY3a",
  "signature": "ed25519:cbdcd01b5617d873bb1bb59d8155b218351b17333a01cfe14885a3728ab4efd158df03572bb13a1a763fc85a1c4d0284ed298c45487aea921bbdae9364e0ad0f",
  "timestamp": "2026-10-19T19:31:01.670Z"
}
